{
  "schema_version": "duplexpo.recipe.v1",
  "recipe_id": "duplexpo-paper-v1",
  "paper": "https://arxiv.org/abs/2607.07148",
  "protocol_version": "duplexpo.v1",
  "construction": {
    "split_unit": "conversation",
    "max_duration_s": 210.0,
    "mixing": "randomized_round_robin",
    "mixing_seed": 42,
    "sampling_weights": {"fisher": 1.0, "seamless_hq_v1": 1.0},
    "profile_sha256": {
      "fisher": "c4ca77c63aab3f25c2922faaf5dc5dde9ba2725109e071134c91b9d6debe2a9e",
      "seamless_hq_v1": "8f175206a8720f123e5a4ab8beac2973f8a2666b7a80ecb0b0298a3d55b8aefa"
    },
    "augmentation": {
      "specaugment": {"enabled": true, "implementation": "backend_native"},
      "waveform_noise": {
        "probability": 0.5,
        "snr_db_uniform": [0.0, 60.0],
        "reported_sources": ["Freesound", "MUSAN"],
        "implementation": "input_adapter"
      }
    },
    "fisher": {
      "granularity": "word",
      "alignment_source": "nemo_forced_aligner",
      "role_policy": "first_speaker_becomes_user",
      "word_gap_s": 0.3,
      "turn_merge_gap_s": 1.2,
      "lexical_bc_max_duration_s": 0.8,
      "lexical_bc_max_words": 4,
      "high_order_bc_max_duration_s": 1.2,
      "high_order_bc_max_words": 6,
      "fallback_bc_max_duration_s": 0.3,
      "merge_strategy": "fisher"
    },
    "seamless_hq_v1": {
      "granularity": "utterance",
      "role_policy": "actor_then_prompt_then_first_speaker",
      "turn_merge_gap_s": 1.0,
      "utterance_bc_max_duration_s": 1.5,
      "utterance_bc_max_words": 6,
      "fragment_max_duration_s": 0.3,
      "fragment_max_words": 2,
      "excluded_interaction_types": ["charades"],
      "merge_strategy": "seamless"
    },
    "backchannel_lexicon": {
      "unigrams": 340,
      "bigrams": 221,
      "trigrams": 153,
      "quadgrams": 71,
      "pentagrams": 17,
      "historical_sha256": "5e46a4f9e5a40b3413de81ad77e2b3e06bed3d3b1c9c6482e84b6a0474d1c681"
    }
  },
  "windows": {
    "frame_duration_s": 0.08,
    "training_lead_time_s": 1.0,
    "validation_lead_time_s": 2.0,
    "buffer_s": 2.0,
    "min_window_start_s": 2.0,
    "min_turn_duration_s": 2.0,
    "min_backchannel_duration_s": 0.0,
    "max_turn_windows": 3,
    "max_backchannel_windows": 1,
    "max_rollout_frames": 200,
    "reference_margin_frames": 3,
    "selection_seed": 42,
    "portable_selection_seed_strategy": "sha256(seed:conversation_id)",
    "historical_selection_seed_strategy": "target_token_ids[0]+target_token_ids[min(T//2,T-1)]",
    "historical_replay_override_metadata_key": "window_selection_seed"
  },
  "rollout": {
    "samples_per_window": 4,
    "temperature": 1.0,
    "top_p": 0.9
  },
  "reward": {
    "backchannel_plateau_s": 0.5,
    "backchannel_max_talk_s": 1.5,
    "turn_sigma_early_s": 0.2,
    "turn_sigma_late_s": 0.5,
    "miss_penalty": -0.5,
    "false_alarm_penalty": -0.5,
    "backchannel_overlong_penalty": -0.5,
    "turn_no_eos_scale": 0.75,
    "observable_margin_s": 0.16,
    "interruption_grace_s": 0.16
  },
  "grpo": {
    "group_key": "window_id",
    "advantage_normalization": "population_mean_std_per_event",
    "advantage_epsilon": 1e-8,
    "advantage_clip": 5.0,
    "loss_mask": "sampled_actions_only",
    "token_reduction": "sum_then_divide_by_real_rollouts",
    "kl_estimator": "exp(log_ratio)-log_ratio-1",
    "kl_beta": 0.2,
    "kl_log_ratio_clip": 10.0,
    "kl_value_clip": 20.0,
    "kl_reference": "frozen"
  },
  "optimizer": {
    "name": "AdamW",
    "learning_rate": 1e-5,
    "betas": [0.9, 0.98],
    "weight_decay": 0.0,
    "scheduler": "inverse_square_root",
    "warmup_steps": 100,
    "minimum_learning_rate": 1e-6
  },
  "training": {
    "parameterization": "full_parameter",
    "trainable_modules": "llm_backbone",
    "frozen_modules": ["speech_encoder", "codec"],
    "batch_unit": "conversation",
    "windows_per_conversation": "variable; all selected windows of the conversation (at most 3 full-turn + 1 backchannel)",
    "samples_per_window": 4,
    "gpus": {"count": 64, "type": "A800-80GB"},
    "precision": "bfloat16",
    "gradient_clip_norm": 1.0,
    "notes": [
      "Step count and conversations per step are chosen per model/setup (the reported run converged within a few tens of steps); the recipe does not fix them.",
      "learning_rate 1e-5 in `optimizer` is the full-parameter RL learning rate.",
      "With LoRA adapters the policy does not move within tens of steps at lr 1e-5; use roughly 10x (about 1e-4) and tune.",
      "The batch is formed from conversations, not from a fixed number of windows: every selected window of each conversation in the batch is used, so windows (and rollouts = windows * 4) per step vary with the data."
    ]
  }
}
